{
  "catalog_id": "agentops.evaluation.metric-catalog",
  "version": "1.0.0",
  "status": "PUBLISHED",
  "semantic_authority": "crystra-contracts/docs/contracts/evaluation/metric-catalog.md@evaluation.identity.001",
  "input_definitions": [
    {
      "input_id": "evaluation.defined-task-snapshot",
      "source_layer": "evaluation",
      "semantic_ref": "Metric Catalog §6.2 immutable defined-task membership/cohort snapshot",
      "binding": "human-semantic-reference"
    },
    {
      "input_id": "evaluation.event-time-role-template",
      "source_layer": "evaluation",
      "semantic_ref": "Metric Catalog §6.2 exact event-time role-template assignment",
      "binding": "human-semantic-reference"
    },
    {
      "input_id": "evaluation.unique-terminal-task-outcome",
      "source_layer": "evaluation",
      "semantic_ref": "Metric Catalog §6.2 fail-closed terminal-task reading",
      "binding": "human-semantic-reference"
    },
    {
      "input_id": "observation.delivery-identity",
      "source_layer": "observation",
      "semantic_ref": "Observation Catalog Delivery Summary → Delivery identity",
      "binding": "human-semantic-reference"
    },
    {
      "input_id": "observation.delivery-outcome",
      "source_layer": "observation",
      "semantic_ref": "Observation Catalog Delivery Summary → Delivery outcome",
      "binding": "human-semantic-reference"
    },
    {
      "input_id": "observation.delivery-elapsed-time-c55",
      "source_layer": "observation",
      "semantic_ref": "OTel Observation Profile 1.0.0 C55 agentops.delivery.elapsed_time_ms",
      "binding": "human-semantic-reference"
    },
    {
      "input_id": "observation.delivery-stage-reached-c56",
      "source_layer": "observation",
      "semantic_ref": "OTel Observation Profile 1.0.0 C56 agentops.delivery.stage.reached",
      "binding": "human-semantic-reference"
    },
    {
      "input_id": "observation.model-call-identity",
      "source_layer": "observation",
      "semantic_ref": "Observation Catalog recorded model-call activity and exact Span identity",
      "binding": "human-semantic-reference"
    },
    {
      "input_id": "observation.model-call-span-duration",
      "source_layer": "observation",
      "semantic_ref": "OTel Observation Profile 1.0.0 native host-reported model-call Span duration",
      "binding": "human-semantic-reference"
    },
    {
      "input_id": "observation.model-role-attribution-tuple",
      "source_layer": "observation",
      "semantic_ref": "OTel Observation Profile 1.0.0 complete provider+C57+C30+C06+Span tuple",
      "binding": "human-semantic-reference"
    },
    {
      "input_id": "observation.packet-identity",
      "source_layer": "observation",
      "semantic_ref": "Observation Catalog Implementation Summary → implementation packet identity",
      "binding": "human-semantic-reference"
    },
    {
      "input_id": "observation.repair-link",
      "source_layer": "observation",
      "semantic_ref": "Observation Catalog Review Finding → Fix-to-Finding edge",
      "binding": "human-semantic-reference"
    },
    {
      "input_id": "observation.reported-cost",
      "source_layer": "observation",
      "semantic_ref": "Observation Catalog Usage → source, kind, unit and value",
      "binding": "human-semantic-reference"
    },
    {
      "input_id": "observation.standard-token-usage",
      "source_layer": "observation",
      "semantic_ref": "Observation Catalog recorded model-call input/output token measurements",
      "binding": "human-semantic-reference"
    },
    {
      "input_id": "observation.usage-source",
      "source_layer": "observation",
      "semantic_ref": "Observation Catalog Usage → explicit applicable usage source",
      "binding": "human-semantic-reference"
    },
    {
      "input_id": "observation.fact-identity",
      "source_layer": "observation",
      "semantic_ref": "Observation Catalog eligible operational or Delivery fact identity",
      "binding": "human-semantic-reference"
    },
    {
      "input_id": "observation.fact-provenance",
      "source_layer": "observation",
      "semantic_ref": "Observation Catalog readable accepted provenance classification, including direct and nondirect basis",
      "binding": "human-semantic-reference"
    },
    {
      "input_id": "projection.compatibility-eligibility",
      "source_layer": "projection",
      "semantic_ref": "evidence.projection fact-level compatibility keys and eligibility attributes",
      "binding": "human-semantic-reference"
    }
  ],
  "metrics": [
    {
      "metric_id": "role-template-rework-rate",
      "version": "1.0.0",
      "name": "Role-template rework rate",
      "status": "planned",
      "evaluation_unit": "eligible terminal task in one event-time role-template cohort",
      "value_semantics": {
        "kind": "rate",
        "unit": "ratio",
        "missing": "N/A when no eligible terminal tasks exist"
      },
      "dimensions": [
        "role template",
        "task cohort"
      ],
      "filters": [
        "exact event-time assignment",
        "unique terminal task outcome"
      ],
      "time_window": "declared as-of cutoff and event-time role-template cohort",
      "calculation": "Terminal tasks with at least one linked attributable repair divided by eligible terminal tasks; publish numerator and denominator.",
      "input_refs": [
        "evaluation.defined-task-snapshot",
        "evaluation.event-time-role-template",
        "evaluation.unique-terminal-task-outcome",
        "observation.repair-link",
        "projection.compatibility-eligibility"
      ],
      "eligibility": [
        "task passes Metric Catalog §6.2",
        "event-time role template is exact"
      ],
      "exclusions": [
        "open, mixed or undefined task",
        "backfilled or missing template assignment"
      ],
      "minimum_sample": 20,
      "uncertainty": [
        "repair association is descriptive and not causal"
      ],
      "forbidden_inference": [
        "do not infer template causality",
        "do not backfill assignments"
      ],
      "owner": "evidence-governance-owner",
      "coverage": {
        "denominator": "tasks in the immutable defined-task snapshot with exact identity, time window, cohort and role-template scope",
        "numerator": "denominator units with unique terminal-task outcome and repair-attribution inputs available"
      }
    },
    {
      "metric_id": "role-template-trajectory-partial-cost",
      "version": "1.0.0",
      "name": "Role-template trajectory partial cost",
      "status": "planned",
      "evaluation_unit": "eligible terminal task trajectory in one event-time role-template cohort",
      "value_semantics": {
        "kind": "money",
        "unit": "source currency",
        "missing": "N/A when no attributable same-currency cost exists"
      },
      "dimensions": [
        "role template",
        "task cohort",
        "currency",
        "cost basis"
      ],
      "filters": [
        "exact event-time assignment",
        "direct reported cost"
      ],
      "time_window": "declared as-of cutoff and event-time role-template cohort",
      "calculation": "Sum linked provider/host-reported cost for covered task trajectories separately by exact currency, source and cost basis; publish coverage.",
      "input_refs": [
        "evaluation.defined-task-snapshot",
        "evaluation.event-time-role-template",
        "evaluation.unique-terminal-task-outcome",
        "observation.reported-cost",
        "projection.compatibility-eligibility"
      ],
      "eligibility": [
        "task passes Metric Catalog §6.2",
        "direct cost has exact source, currency and cost basis"
      ],
      "exclusions": [
        "mixed currency, source or cost basis",
        "estimated or unattributed cost"
      ],
      "minimum_sample": 20,
      "uncertainty": [
        "reported value is partial attributable cost"
      ],
      "forbidden_inference": [
        "do not label as total cost",
        "do not convert currency implicitly"
      ],
      "owner": "evidence-governance-owner",
      "coverage": {
        "denominator": "tasks in the immutable defined-task snapshot with exact identity, time window, cohort and role-template scope",
        "numerator": "denominator units with unique terminal-task outcome and exact cost source, currency and cost-basis inputs available"
      }
    },
    {
      "metric_id": "role-model-task-outcome-rate",
      "version": "1.0.0",
      "name": "Role-model task outcome rate",
      "status": "planned",
      "evaluation_unit": "eligible terminal task with complete canonical model-role attribution",
      "value_semantics": {
        "kind": "rate",
        "unit": "ratio",
        "missing": "N/A when no eligible attributed terminal tasks exist"
      },
      "dimensions": [
        "provider",
        "model",
        "role",
        "runtime",
        "task outcome"
      ],
      "filters": [
        "unique terminal task outcome",
        "complete attribution tuple"
      ],
      "time_window": "declared as-of cutoff and comparable cohort",
      "calculation": "Tasks in each unique task-outcome category divided by eligible attributed terminal tasks; publish numerator and denominator per category.",
      "input_refs": [
        "evaluation.unique-terminal-task-outcome",
        "observation.model-role-attribution-tuple",
        "projection.compatibility-eligibility"
      ],
      "eligibility": [
        "unique terminal task outcome",
        "complete canonical model-role tuple"
      ],
      "exclusions": [
        "open or mixed-outcome task",
        "incomplete attribution"
      ],
      "minimum_sample": 20,
      "uncertainty": [
        "outcome difference is descriptive"
      ],
      "forbidden_inference": [
        "do not infer model causality",
        "do not compare incompatible cohorts"
      ],